{
  "workflow_id": "permit-application",
  "target_url": "http://127.0.0.1:3000/permits/apply",
  "version": 1,
  "fields": {
    "input_permit_id": "#permit-id",
    "input_applicant_name": "#applicant-name",
    "submit_button": "#submit-btn",
    "status_badge": "[data-testid='status-badge']"
  }
}
